番号	名称	HP	SAN	速度	斬撃	貫通	打撃	弾丸	パッシブ名	発動条件	効果	戦術0名称	戦術0効果	戦術1名称	戦術1効果	戦術2名称	戦術2効果	戦術3名称	戦術3効果	戦術4名称	戦術4効果	強化スキル	固有
1	黒雲会組員の人格	105	48	1d5	抵抗	普通	弱点	なし	抉り出し	色欲 x2 共鳴	マッチ勝利時、対象が出血状態なら、スキルの最後のダイス威力+1	切り払う	斬撃反撃：憤怒 <br>2d6 ：的中時、出血2を付与 	鋭い刃先	斬撃：暴食 <br>使用時：次に自分が戦術スキルを使用したとき、この戦術のダイスをスキルの最後に追加する <br>2d7 	後始末	貫通：傲慢 <br>3d5 ：的中時、次のRに出血2を付与 <br>2d7 	飛び散る剣撃	斬撃：憂鬱 <br>使用時：対象の出血5ごとに保護1を得る（最大3） <br>2d11+2：的中時、脆弱1を付与 	快刀乱麻	斬撃：色欲 <br>対象の出血4ごとにダメージ量+1（最大5） <br>マッチ敗北時：スキル威力-10 <br>16-1d10 ：破壊不能ダイス。的中時、次のRに出血3を付与	なし	なし
2	黒雲会若衆の人格	121	50	2d3	抵抗	弱点	普通	なし	鋭利な一撃	色欲 x2 保有	マッチ勝利時、出血 1 を付与	防御	防御：色欲<br>戦闘開始時：保護1を得る <br>8d2 	発勁	貫通：憤怒<br>対象の出血が7以上ならダメージ量+3 <br>2d8	雲の切開	斬撃：傲慢 <br>攻撃前：対象の出血が10未満なら、この戦術の全ダイスをスキルの最後に追加する <br>2d7 ：的中時、次のRに出血1を付与 <br>2d5 ：的中時、次のRに出血1を付与 	静かな霧	斬撃：色欲<br>使用時：次のRに出血保護3を得る<br>2d10 <br>3d5 ：的中時、次のRに出血1を付与 	雲の破裂	斬撃：憤怒<br>戦闘開始時：保護1を得る<br>マッチ勝利時：次のRに保護1を得る<br>5d2+2 ：的中時、次のRに麻痺1を付与 <br>5d2+2 ：的中時、次のRに出血2を付与 	なし	なし
3	剣契殺手 A の人格	114	48	1d7	抵抗	弱点	普通	なし	共に吸う息	傲慢 x2 共鳴	自分がスキルで呼吸を得るとき、呼吸が最も少ない味方 1 名に呼吸 2 を付与	反撃-初生	斬撃反撃：憤怒<br> 2d7 ：的中時、呼吸4を得る<br> 2d4	抜剣	斬撃：傲慢<br> 使用時：呼吸2を得る<br> 2d7<br> 2d8 ：的中時、呼吸3を得る	剣軌	斬撃：嫉妬 <br>自分の呼吸が7以上ならスキル威力+1 <br>使用時：呼吸2を得る<br> 2d8 ：クリティカルダメージ量+3 <br>2d8 ：クリティカルダメージ量+3	連斬	斬撃：憤怒<br> マッチ勝利時：このRでクリティカル成功時、呼吸を消費しない <br>マッチ敗北時：次のRにパワー2を得る <br>2d7 ：的中時、呼吸2を得る<br> 2d7 ：的中時、呼吸1を得る <br>2d9 ：的中時、呼吸1を得る	骨断	斬撃：傲慢<br> 自分の呼吸が10以上ならクリティカルダメージ量+5<br> 2d13	なし	なし
4	剣契殺手 B の人格	125	50	1d6	抵抗	普通	弱点	なし	殺手	傲慢 x4 保有	マッチ勝利時、呼吸 2 を得る	殺主	斬撃反撃：傲慢<br>1d15 ：クリティカルダメージ量+7	撃勢	斬撃：傲慢 <br>マッチ勝利時：呼吸6を得る<br> 2d9 ：クリティカルダメージ量+5	処断	斬撃：憤怒<br> 自分の呼吸が7以上ならスキル威力+2 <br>使用時：呼吸2を得る<br> 4d3 ：的中時、呼吸2を得る。クリティカルダメージ量+3<br> 5d2+1 ：的中時、呼吸2を得る	切動	斬撃：怠惰 <br>自分の呼吸が7以上ならスキル威力+2 <br>戦闘開始時：両隣の味方に呼吸2を付与<br> 6d2<br> 6d2 ：クリティカルダメージ量+4	異面賛刺	斬撃：嫉妬<br> 呼吸5ごとにスキル威力+1（最大2）<br> 6d2 ：クリティカルダメージ量+1<br> 6d2 ：クリティカルダメージ量+1<br>7d2 ：クリティカルダメージ量+4	なし	なし
5	南部親指ソルダート II の人格	121	58	1d8	弱点	普通	抵抗	15	階級と尊重	傲慢 x3 保有	銃撃ダイスではない攻撃ダイスを 3 回的中させるごとに、保有弾丸数を 1 回復	鉄の防御	防御：傲慢<br> 2d10	銃剣術	斬撃：暴食<br> このスキルは捨てても選択欄から除去されない<br> 使用時：1d3を振りランダムな弾丸へと[弾倉変換]（徹甲弾、氷結 弾、火炎弾）<br> 2d7 ：的中時、次のRに出血2を付与<br> 2d6 <br>2d4 <br>2d4	牽制射撃	打撃：憂鬱 <br>このスキルが捨てられたならマッチ中に対象の受ける出血ダメージ 量+2 <br>使用時：ランダムなスキルを1つ捨てる。捨てたスキルが戦術1な らばマッチ威力+1<br> 3d7 ：銃撃。的中時、弾丸を1消費し次のRに出血3を付与 <br>2d9 ：銃撃。的中時、弾丸を1消費	衝撃弾	打撃：傲慢 <br>このスキルが捨てられたなら保有弾丸数を2回復<br> 使用時：ランダムなスキルを1つ捨てる。捨てたスキルが戦術1ならばスキル威力+1<br> 5d3 ：銃撃。的中時、弾丸を1消費し固定SANダメージを6 <br>3d5 ：銃撃。的中時、弾丸を1消費し次のRに脆弱2を付与	火力集中	斬撃：嫉妬<br> このスキルが捨てられたなら弾丸消費量が1増加し弾丸効果が2倍 になる <br>使用時：ランダムなスキルを2つ捨てる <br>4d5 ：銃撃。的中時、弾丸を1消費し次のRに脆弱1を付与<br> 3d7 ：銃撃。的中時、弾丸を1消費	なし	[弾丸-徹甲弾] <br>銃撃ダイスでマッチする時、対象のマッチ威力-1<br> 消費することで特定戦術の能力が向上<br> [弾丸-氷結弾]<br> 銃撃ダイスで攻撃的中時、次のRに武装解除1を付与<br> 銃撃ダイスでマッチ勝利時、次のRに麻痺1を付与<br> 消費することで特定戦術の能力が向上<br> [弾丸-火炎弾]<br> 銃撃ダイスで攻撃的中時、火傷2を付与<br> 消費することで特定戦術の能力が向上
6	東部親指ソルダート II の人格	125	50	3d2	弱点	抵抗	普通	15	規律執行	怠惰 x4 保有	常時発動 舞台開始時、自分の弾丸を灼熱推進弾へと[弾倉変換] 効果 前の R に敵を混乱させたなら、的中時、振動 2 を付与	鉄の防御	防御：傲慢<br> 2d10	銃剣術【爆】	斬撃：色欲<br> 使用時：対象の振動と火傷の合計が15以上ならこのスキルの最後のダイスを破壊不能ダイスに変更<br> 2d4<br> 2d6<br> 2d8 ：的中時、[振動爆発]。振動を3消費	親指へ尊重を。	貫通：怠惰 <br>使用時：対象の火傷と振動の合計7ごとにスキル威力+1（最大2）<br> 3d4：的中時、振動2を付与 <br>4d4：的中時、振動2を付与	灼熱突き	貫通：憤怒 <br>使用時：対象の火傷と振動の合計7ごとにスキル威力+1（最大2） 5d3 ：的中時、火傷3を付与<br> 2d10 ：的中時、火傷3を付与	推力集中	斬撃：憤怒<br> 使用時：対象の火傷と振動の合計7ごとにスキル威力+1（最大2）<br>8d2 ：的中時、弾丸を1消費し振動3と火傷3を付与<br>8d2 ：的中時、弾丸を1消費し[振動爆発]。対象の振動を1消費 対象の振動を振動-灼熱へと[振幅変換]	なし	[弾丸-灼熱推進弾] 弾丸を消費するダイスのダメージ量+2。自分の速度が6以上なら追加でダメージ量+3 消費することで特定戦術の能力が向上
7	人差し指遂行者：【紙片】の人格	120	55	2d3+1	抵抗	普通	弱点	なし	指令[紙片]	怠惰x1 傲慢x1 憂鬱x1 保有	常時発動<br>R開始時、ランダムな敵1名に指令対象を付与。<br>指令の印スキルが存在しないなら、戦術スキル0~4からラ ンダムに1つを指令の印スキルに指定する。<br>以下の行動1回につき、指令の加護1を得て（1Rに最大3）、SANを3回復（最大9）する。<br>・指令の印スキルの使用時<br>・指令の印スキルで攻撃後<br>・指令対象に攻撃後<br>これらを1つも達成できなかった場合、R終了時にカルマ1を得る。<br>混乱・行動不能・E.G.O侵蝕状態・指令の加護が9ならカルマを得ない。<br>効果<br>攻撃的中時、指令の加護の数3ごとに沈潜1を付与	信心	斬撃反撃：憂鬱<br>指令の加護3につきダメージ量+1<br>戦闘開始時：バリア20を得る。カルマの数だけ得るバリアの数-2 <br>2d7<br>2d7 ：的中時、沈潜1を付与 <br>2d9 ：的中時、沈潜2を付与 	遂行者の剣 	斬撃：怠惰<br>このスキルが指令の印スキルなら、マッチ威力+3、ダメージ量+2 <br>使用時：呼吸2を得る<br>マッチ開始時：マッチ威力-2<br>7d2 ：的中時、呼吸2を得る<br>2d9 ：的中時、沈潜1を付与。クリティカル的中時、沈潜2を付与	処刑	斬撃：嫉妬 <br>このスキルが指令の印スキルなら、スキル威力+1、最初のダイスのダメージ量+4<br>使用時：呼吸3を得る<br>敵討伐時：呼吸8を得る <br>5d2+3 ：クリティカルダメージ量+4 <br>2d7+1 ：的中時、対象の沈潜を1回発動 	指令遂行 	斬撃：傲慢<br>このスキルが指令の印スキルなら、スキル威力+2<br>使用時：呼吸4を得る<br>4d3 ：的中時、呼吸1を得る<br>4d3 ：的中時、沈潜1を付与<br>2d8 ：的中時、沈潜1を付与。クリティカル的中時、沈潜2を付与 	指令の向かう処 	斬撃：憂鬱<br>このスキルが指令の印スキルなら、スキル威力+4<br>戦闘開始時：指令の加護が6以上なら、このスキルの全ダイスを破壊不能ダイスに変更<br>使用時：呼吸1を得る。指令の加護の数だけ追加で呼吸を得る<br>2d5 ：的中時、呼吸2を得る<br>2d5 ：的中時、沈潜1を付与<br>2d7 ：指令の加護の数だけダメージ量増加。的中時、沈潜２を付与。クリティカル的中時、沈潜2を付与 	なし	[指令対象] 最大1 中立バフ<br>人差し指所属人格の数に関係なく、毎R敵1名にのみ付与される。<br>R終了時、除去<br>[指令の加護] 最大9 バフ<br>数値/3だけダメージ量増加、数値が9ならマッチ威力+1<br>[カルマ] 最大20 デバフ<br>数値/2だけ被ダメージ量増加（最大10） 
8	中指末弟・末妹の人格	120	50	1d7	弱点	普通	抵抗	なし	中指は忘れない	嫉妬 x4 保有	常時発動 前の R に味方へスキルで最も多くダメージを与えた対象に、仕返し対象 1 を付与 効果 対象が仕返し対象状態ならスキル威力+1。<br>自分が 3 回以上対象から攻撃を受けたなら次の R に嫉妬ダメージ量増加 3 を得る	お返し	打撃反撃：嫉妬<br> 5d2 ：的中時、麻痺2を付与 <br>2d8	みぞおちを殴る	打撃：憤怒 <br>2d8 ：的中時、麻痺1を付与	頭を打つ	打撃：暴食 <br>使用時：対象が仕返し対象なら脆弱1を付与<br> 2d9 <br>2d6 ：的中時、虚弱1を付与	義理の鎖	打撃：嫉妬<br> 戦闘開始時：両隣の味方に嫉妬威力増加1を付与<br> 5d2 ：的中時、次のRに出血1を付与<br> 5d2 ：的中時、次のRに出血1を付与	苦痛を刻む	打撃：嫉妬<br>嫉妬共鳴数が3以上ならスキル威力+1。4以上ならさらに+1<br>4d3<br>5d2 ：的中時、仕返し対象なら次のRに嫉妬脆弱3を付与<br>5d2 ：的中時、仕返し対象なら次のRに虚弱2を付与	なし	[仕返し対象] 最大1 中立バフ 中指の特定能力が上昇。R終了時に消滅
9	薬指点描派 スチューデントの人格	108	54	1d8	弱点	抵抗	普通	なし	血点描画	色欲 x2 共鳴	出血状態の対象へ攻撃的中時、SAN を 2 回復	回避	回避：色欲<br> 8d2	スケッチ	貫通：色欲<br> 2d5 ：的中時、次のRに出血1を付与<br> 2d4 ：的中時、次のRに出血1を付与<br> 2d4 ：的中時、次のRに出血2を付与	上塗り	貫通：憂鬱 <br>使用時：対象の出血が5以上ならスキル威力+1<br> 4d<br> 4d2<br> 4d2 ：的中時、対象の出血の数だけ固定ダメージを与える（最大30）	血描画	貫通：憤怒<br> 2d9 ：的中時、出血1を付与。対象に出血があるなら脆弱2を付与<br> 2d9 ：マッチ勝利的中時、このダイスを再使用（最大1回） 的中時、次のRに出血1を付与	血雫花	貫通：暴食<br>マッチ勝利時：対象に出血があるならSANを10回復 対象のデバフの種類だけダメージ量+1（最大5）<br>2d7 ：的中時、次のRに出血1を付与<br>2d7 ：的中時、次のRに出血1を付与<br>3d5 ：的中時、対象の出血が8以上なら出血-裂傷へと[血蓮変換]	なし	なし
10	カジノ警備員の人格	115	55	2d2+1	弱点	普通	抵抗	なし	牽制	憤怒 x4 保有	お互いの速度が同じならマッチ威力+2	耐える	防御：憤怒<br> 6d2 ：守備時、振動2を付与<br> 5d2 ：守備時、振動2を付与	動くな！	打撃：怠惰<br> 2d8 ：的中時、対象の振動が10以上なら[振動爆発]。振動を3消費 [振動爆発]が発動したなら次のRに束縛2を付与	侵入者発見	打撃：嫉妬 <br>対象の振動6ごとにスキル威力+1（最大2）<br> 2d7<br> 3d4 ：的中時、対象の振動5ごとにダメージ量+1（最大5） <br>3d4 ：的中時、振動2を付与	捕捉	貫通：傲慢<br> マッチ勝利時：振動付与量+1 <br>3d5 ：的中時、振動3を付与 <br>3d5 ：的中時、振動1を付与	おとなしくしてろ	打撃：憤怒<br>5d2 ：的中時、[振動爆発]。振動を3消費<br>5d2 ：的中時、[振動爆発]。振動を3消費	なし	なし
11	ぽんぽん派 構成員の人格	110	50	1d6	抵抗	普通	弱点	なし	愉悦	暴食 x2 共鳴	暴食共鳴数 x2 だけ SAN を回復	失せろ！	斬撃反撃：嫉妬<br> 2d7 ：的中時、次のRに出血2を付与	首切り	斬撃：嫉妬<br> 2d9 ：的中時、出血1を付与。最大値的中時、次のRに出血4を付 与	きらめく願望	貫通：暴食<br> 使用時：次のRにパワー2を得る <br>2d7<br> 2d7	抉る	斬撃：色欲 <br>攻撃後：対象のHPが50％未満ならこのスキルをもう1度使用する <br>3d<br>5 3d4 ：的中時、固定ダメージ3を与える	滅多斬り	斬撃：暴食<br>敵討伐時：このスキルをランダムな敵に再使用（最大1回）<br>2d7 ：的中時、固定ダメージ2を与える<br>2d7 ：的中時、固定ダメージ3を与える<br>2d9 ：的中時、固定ダメージ4を与える	なし	なし
12	マリアッチ構成員の人格	100	55	2d3	抵抗	弱点	普通	なし	パーティータイム！	憂鬱 x4 共鳴	戦闘開始時、全ての味方の SAN を 1～5 回復。<br>自分の SAN が 30 以上なら呼吸 5 を得る	エクセレンテ！	回避：憂鬱 <br>8d2 ：回避成功時、SANを5回復	情熱の踊り	斬撃：嫉妬<br> マッチ開始時：対象の沈潜が6以上ならマッチ威力+2 <br>2d5 ：的中時、沈潜2を付与<br> 2d4 ：的中時、沈潜2を付与 <br>2d3	ダンス対決	貫通：怠惰<br>使用時：呼吸4を得る<br> 3d5 ：的中時、沈潜1を付与<br> 3d5 ：的中時、沈潜1を付与 3d5	興が乗った刺突	貫通：憤怒<br> 使用時：呼吸が10以上かつ自分にデバフがあるなら、ランダムにデバフを1つ除去し呼吸を5消費<br> 2d9 ：的中時、沈潜2を付与 <br>2d7 ：的中時、沈潜2を付与<br> 2d7 ：クリティカルダメージ量+3	パニャータパーティ～！	斬撃：憂鬱<br>マッチ開始時：対象の沈潜3ごとにスキル威力+1（最大3）<br>2d7<br>2d9<br>2d9<br>1d8 ：クリティカル的中時、与えたダメージ量だけSANを回復	なし	なし
13	鉄工会組織員の人格	130	47	1d7	普通	弱点	抵抗	なし	殺伐とした歓迎挨拶	色欲 x3 共鳴	マッチ進行時、対象が出血状態なら、その対象が恐慌で受けるダメージ量+3	目ン玉どけろや？	打撃反撃：憂鬱<br> 8d2 ：的中時、次のRに恐慌2を付与	降り注ぐ悪口	斬撃：憂鬱<br> 使用時：ランダムな味方1名のSANを2回復<br> 2d7<br> 2d7 ：的中時、固定SANダメージ5を与える	どたまを割っぞ	斬撃：色欲 <br>対象が恐慌状態ならスキル威力+2 <br>2d10 ：的中時、次のRに出血3を付与	ブッちぎっちゃる	打撃：嫉妬 <br>5d3：的中時、次のRに恐慌2を付与<br> 5d3 ：的中時、次のRに恐慌2を付与	やめぃ！	打撃：怠惰<br>マッチ勝利時：対象の恐慌が10以上なら精神崩壊1を付与<br>3d8 ：的中時、次のRに麻痺2を付与	なし	なし
14	双鉤海賊団 組員の人格	115	50	1d7	抵抗	弱点	普通	なし	余裕な呼吸	色欲 x3 共鳴	クリティカルダメージ量+1。<br>マッチ勝利時、呼吸 5 を得る	そこチクッとしないか？	回避：傲慢 <br>2d8 ：回避成功時、対象が出血状態ならSANを4回復	鉤裂き	斬撃：色欲<br> 使用時：呼吸3を得る<br> 2d8 ：的中時、次のRに出血2を付与	虜獲	貫通：憤怒 <br>使用時：呼吸3を得る<br> 6d2 ：クリティカルダメージ量+2<br> 2d3 ：クリティカルダメージ量+2 <br>2d2 ：クリティカルダメージ量+2	隙を払う	斬撃：傲慢<br> マッチ勝利時：対象の呼吸を吸収（最大10）<br> 3d5 <br>3d6 ：クリティカル的中時、次のRに出血3を付与	戦場の喊声	斬撃：色欲<br>戦闘開始時：自分の速度と異なる速度の味方全員から呼吸を吸収 （1名ごとに最大3）<br>2d10 ：クリティカル的中時、次のRに出血3を付与<br>2d8 ：的中時、出血3を付与。クリティカルダメージ量+1	なし	なし
15	ピークォド号航海士の人格	117	57	1d7	普通	抵抗	弱点	なし	注入された憎悪と憎しみ	傲慢 x3 共鳴	R 終了時、HP が 50％未満なら次の R にパワー1 を得る	防御	防御：怠惰<br> 2d9 ：守備時、次のRにダメージ量増加1を得る	刺す	貫通：傲慢<br> 2d9 ：マッチ勝利的中時、次のRに出血4を付与	傷口穿ち	貫通：嫉妬 <br>マッチ勝利時：呼吸7を得る<br> 3d5 ：的中時、次のRに出血2を付与<br> 3d5 ：的中時、次のRに出血2を付与 <br>3d5	闘志の銛	貫通：色欲 <br>使用時：獲物の印が対象にあるならマッチ威力+2<br> クリティカル成功時：SANを10回復<br> 5d2+3 ：的中時、次のRに出血1を付与し、呼吸1を得る<br> 5d2+3 ：的中時、次のRに出血1を付与し、呼吸1を得る<br> 5d2+3 ：的中時、次のRに出血1を付与し、呼吸1を得る	投擲	貫通：傲慢<br>使用時：呼吸6を得る<br>攻撃後：このスキルを捨てる<br>9d2+4 ：的中時、次のRに束縛2と脆弱2を付与 クリティカルダメージ量+4	なし	なし
16	デッドラビッツ 構成員の人格	125	50	1d3+2	抵抗	弱点	普通	なし	時間稼ぎ	暴食 x2 共鳴	対象が破裂状態ならマッチ威力+1	反撃	打撃反撃：暴食<br> 2d8<br> 2d5 ：的中時、[破裂爆発]。破裂を2消費	バットで殴る	打撃：色欲<br> 2d8 ：的中時、破裂2を付与	打ち落とす	貫通：憤怒<br> マッチ勝利時：破裂3を付与 <br>3d3+2<br> 4d3+2 ：的中時、破裂1を付与<br>2d2+3 ：的中時、[破裂爆発]。破裂を5消費	腹いせ	打撃：嫉妬<br> 2d8 ：的中時、破裂2を付与<br> 6d2 ：的中時、対象の破裂が10以上なら[破裂爆発]。破裂を3消費	打っ付ける	打撃：暴食<br>マッチ開始時：対象の破裂4ごとにスキルd値+1（最大2）<br>2d6<br>2d6<br>2d7<br>2d8 ：的中時、破裂4とダメージ量減少2を付与	なし	なし
17	20区ユロージヴィ団員の人格	100	46	1d6	抵抗	弱点	普通	なし	皆の成果	怠惰 x3 共鳴	自分以外の味方が[振動爆発]した時、戦術スキル 1 で追撃（1R に 1 回）	防御	防御：怠惰 <br>戦闘開始時：自分の振動の2倍だけバリアを得る（最大20）<br> 5d2	邪魔するな	打撃：怠惰<br> [結束]<br> 使用時：振動2を得る<br> 2d4 ：的中時、対象の振動の数だけ振動を得る	ネジの抜けた奴らめ	貫通：憤怒<br> [結束] <br>結束スキルを使用する自分以外の味方に「的中時、[振動爆発]。振動を5消費」を最後のダイスに付与（重複不可）<br> 4d2 ：的中時、振動1を付与<br> 4d2 ：的中時、振動1を付与<br> 4d2 ：的中時、振動1を付与 <br>4d2 ：的中時、振動1を付与	圧着ぜんまいスパナ	打撃：憂鬱<br> 自分の振動5ごとにマッチ威力+1（最大2）<br> 5d3 ：的中時、自分の振動の数だけ対象に振動を付与<br> 5d3 ：的中時、[振動爆発]。振動を5消費	卑劣な時計鎖たちめ！	打撃：傲慢<br>[結束]<br>結束スキルを使用する自分以外の味方全員に振動3を付与 （重複不可）<br>3d4<br>3d4<br>3d4<br>3d5 ：的中時、自分の振動を10消費して振動-反響へ[振幅絡縺]	なし	[結束] 結束スキルを使用する時、他の味方が付与する結束効果を得る
18	笑う顔たちの人格	122	48	1d7	普通	普通	普通	なし	煙払い	暴食 x3 共鳴	煙状態の対象に与えるダメージ量+3	隠し刃	マッチ可能斬撃反撃：暴食<br> 使用時：煙を2消費しスキル威力+3<br> 2d9 ：的中時、次のRに出血3を付与	煙管	防御：怠惰 <br>使用時：煙5を得る<br> 2d10<br> 2d6	肉卸し	斬撃：憤怒<br> 使用時：煙を2消費しスキル威力+1<br> 3d6：的中時、次のRに出血1を付与 <br>2d5：的中時、対象の煙2ごとに次のRに出血1を付与	煙の軌跡	打撃：色欲 <br>使用時：煙3を得る<br> 2d9 ：的中時、煙2を付与<br> 2d9 ：的中時、煙1を付与 <br>2d5	深い息遣い	打撃：暴食<br>マッチ開始時：自分の煙の数だけ対象に煙を付与 <br>2d12 ：的中時、対象の煙が9以上なら虚弱2を付与	なし	なし
19	南部ツヴァイ協会 6課フィクサーの人格	124	48	2d3	弱点	普通	抵抗	なし	あなたの盾	憂鬱 x2 共鳴	両隣の味方に保護 1 と忍耐 2 を付与	ガード	防御：憂鬱<br> 使用時：あなたの盾3を得る<br> 8d2	治安維持	打撃：憂鬱<br> マッチ敗北時：保護2を得る <br>6d2	逆襲	打撃反撃：暴食<br> 2d7：的中時、振動2を付与<br> 2d10 ：的中時、振動4を付与	制圧	打撃：憤怒<br> 戦闘開始時：ランダムな味方2名にあなたの盾2を付与<br> マッチ敗北時：振動2を付与<br> 3d5 ：的中時、ダメージ量減少1を付与<br> 2d8 ：的中時、振動3を付与	脳震盪	打撃：怠惰<br>使用時：次のRに挑発値10を得る<br>7d3 ：的中時、[振動爆発]。振動を2消費	なし	なし
20	南部ツヴァイ協会 5課フィクサーの人格	112	54	2d3	弱点	普通	抵抗	なし	指定保護	憂鬱 x5 保有	R 開始時、前方の味方 1 名に保護 2 を付与	ガード	防御：憂鬱 <br>使用時：あなたの盾3を得る<br> 8d2	叩き割る	打撃：怠惰<br> マッチ敗北時：振動2を付与 <br>2d8 ：的中時、振動3を付与	牽制	打撃：色欲 <br>戦闘開始時：両隣の味方2名にあなたの盾2を付与<br> マッチ敗北時：保護1を得る<br> 5d2<br> 5d2 ：的中時、[振動爆発]。振動を2消費	集中防御	打撃：憂鬱 <br>使用時：次のRに挑発値6を得る<br> 3d5 ：的中時、振動1を付与<br> 3d5 ：的中時、振動1を付与。対象の振動3ごとに次のRにあなた の盾1を得る（最大3）	脅威対象制圧	打撃：憤怒<br>自分のあなたの盾が5以上ならスキル威力+2<br>3d4<br>3d4<br>4d4 ：的中時、[振動爆発]	なし	なし
21	南部ツヴァイ協会 4課フィクサーの人格	130	45	3d2+1	普通	弱点	抵抗	なし	保護要請受信	怠惰 x5 保有	戦闘開始時、保護 1 を得る。自分の HP が 50％以下なら追加で保護 1 を得る	ガード	防御：憂鬱<br> 使用時：あなたの盾3を得る <br>8d2	立ち向かう	斬撃：怠惰<br> 使用時：あなたの盾2を得る<br>マッチ敗北時：自分のあなたの盾の数x2だけバリアを得る <br>2d7<br> 2d7	顧客保護	斬撃：嫉妬 <br>使用時：最も現在HPが低い味方1名にあなたの盾2を付与<br> 2d8 ：的中時、振動1を付与<br> 2d8 ：的中時、振動1を付与<br> 2d10 ：的中時、[振動爆発]。振動を4消費	柔軟な制圧	斬撃：暴食 <br>自分のあなたの盾が6以上ならマッチ威力+1 <br>使用時：次のRに挑発値5を得る <br>2d6 ：的中時、次のRにあなたの盾1を得る<br> 2d6 ：的中時、次のRにあなたの盾1を得る<br> 3d4<br> 3d5 ：自分のあなたの盾が6以上ならダメージ量+3	守護者	斬撃：憂鬱<br>使用時：後方の味方3名に忍耐2とあなたの盾3を付与<br>3d4+2<br>3d4+2<br>3d4+2 ：的中時、振動3を付与	なし	なし
